{
  "categoria": "discos-externos",
  "nombre": "Disco duro externo",
  "grupo": "externo",
  "orden": 7,
  "descripcion": "Disco duro portátil de 2.5 pulgadas para respaldos y para transportar archivos grandes.",
  "comparaciones": [
    {
      "id": "hdd-externo-2tb",
      "titulo": "Discos duros externos portátiles de 2 TB",
      "descripcion": "Se alimentan por el mismo cable USB; no necesitan cargador.",
      "productos": [
        {
          "marca": "Western Digital",
          "modelo": "My Passport 2 TB",
          "precioGTQ": 749,
          "tienda": "Intelaf Guatemala",
          "fechaConsulta": "2026-10-02",
          "urlFuente": "https://www.google.com/search?q=site%3Aintelaf.com%2Fprecios_stock_detallado%20Western%20Digital%20My%20Passport%202%20TB%20Guatemala%20precio",
          "verificado": false,
          "imagen": "img/discos-externos/western-digital-my-passport-2-tb-466e778f.jpg",
          "specs": [
            {
              "nombre": "Capacidad",
              "valor": 2,
              "unidad": "TB",
              "mejor": "mayor"
            },
            {
              "nombre": "Interfaz",
              "valor": "USB 3.2 Gen 1",
              "mejor": null
            },
            {
              "nombre": "Protección de datos",
              "valor": "Contraseña y cifrado AES de 256 bits por hardware",
              "mejor": null
            },
            {
              "nombre": "Recuperación de datos incluida",
              "valor": "No",
              "mejor": null
            },
            {
              "nombre": "Garantía",
              "valor": 3,
              "unidad": "años",
              "mejor": "mayor"
            }
          ]
        },
        {
          "marca": "Seagate",
          "modelo": "One Touch 2 TB (HDD)",
          "precioGTQ": 729,
          "tienda": "Intelaf Guatemala",
          "fechaConsulta": "2026-10-02",
          "urlFuente": "https://www.google.com/search?q=site%3Aintelaf.com%2Fprecios_stock_detallado%20Seagate%20One%20Touch%202%20TB%20(HDD)%20Guatemala%20precio",
          "verificado": false,
          "imagen": "img/discos-externos/seagate-one-touch-2-tb-hdd-25fce2e2.jpg",
          "specs": [
            {
              "nombre": "Capacidad",
              "valor": 2,
              "unidad": "TB",
              "mejor": "mayor"
            },
            {
              "nombre": "Interfaz",
              "valor": "USB 3.0",
              "mejor": null
            },
            {
              "nombre": "Protección de datos",
              "valor": "Contraseña",
              "mejor": null
            },
            {
              "nombre": "Recuperación de datos incluida",
              "valor": "Sí (servicio Rescue)",
              "mejor": null
            },
            {
              "nombre": "Garantía",
              "valor": 2,
              "unidad": "años",
              "mejor": "mayor"
            }
          ]
        }
      ],
      "recomendacion": {
        "productoGanador": "My Passport 2 TB",
        "razones": [
          "Cifra por hardware con AES de 256 bits: si el disco se pierde, nadie puede leer los archivos sin la contraseña.",
          "3 años de garantía contra 2, por una diferencia de unos Q20."
        ]
      }
    }
  ]
}
